{
  "$schema": "https://json-schema.org/draft/2020-12/schema",
  "$id": "https://assess.avd-ops.dev/schemas/avd-intake/v1.json",
  "title": "avd-intake/v1: what telemetry can't know about an estate (intake.json)",
  "description": "Contract C19. The operator answers these once per estate, in intake.json beside their landing zone parameters. It gives the fact register's intake.* facts their paths; hostSharing, avdMfa, reportedSymptoms, appDelivery, appCompatibility, profileSolution, hostAgents, clientAgents and agentRdpBypass are optional. Every answer is an enum, a public Azure region or a clock time: the schema has no field for a name, a domain, an address, an ID or free text. Why each question matters is in avd-assess methods/collection.md and gaps/intake.md.",
  "type": "object",
  "required": ["schema", "estate", "answeredOn", "residency", "preferredRegions", "existingHub", "identityConstraints", "workingHours"],
  "additionalProperties": false,
  "$defs": {
    "region": { "type": "string", "pattern": "^[a-z0-9]{2,40}$", "description": "An Azure region's programmatic name, for example eastus2" },
    "clock": { "type": "string", "pattern": "^([01][0-9]|2[0-3]):[0-5][0-9]$" }
  },
  "properties": {
    "$schema": { "type": "string" },
    "schema": { "const": "avd-intake/v1" },
    "estate": { "type": "string", "pattern": "^est-[0-9a-f]{8}$", "description": "The same keyed pseudonym as the estate's C11 snapshot" },
    "answeredOn": { "type": "string", "format": "date" },
    "residency": {
      "type": "object",
      "description": "Fact intake.residency. Whether data must stay in named regions, and which.",
      "required": ["required", "regions"],
      "additionalProperties": false,
      "properties": {
        "required": { "type": "boolean" },
        "regions": { "type": "array", "uniqueItems": true, "maxItems": 10, "items": { "$ref": "#/$defs/region" } }
      },
      "if": { "properties": { "required": { "const": true } } },
      "then": { "properties": { "regions": { "minItems": 1 } } },
      "else": { "properties": { "regions": { "maxItems": 0 } } }
    },
    "preferredRegions": {
      "type": "array",
      "description": "Fact intake.preferredRegions. Most preferred first; the users' own latency measurement decides between them.",
      "uniqueItems": true,
      "maxItems": 3,
      "items": { "$ref": "#/$defs/region" }
    },
    "existingHub": {
      "description": "Fact intake.existingHub. The network the landing zone has to join, if any.",
      "enum": ["none", "azure-hub", "vwan", "other"]
    },
    "identityConstraints": {
      "description": "Fact intake.identityConstraints. The identity lane the estate is held to.",
      "enum": ["entra-only", "hybrid-ad", "entra-ds", "undecided"]
    },
    "workingHours": {
      "type": "object",
      "description": "Fact intake.workingHours. When most users work, for power settings.",
      "required": ["start", "end", "days", "timeZone"],
      "additionalProperties": false,
      "properties": {
        "start": { "$ref": "#/$defs/clock" },
        "end": { "$ref": "#/$defs/clock" },
        "days": { "type": "array", "minItems": 1, "uniqueItems": true, "items": { "enum": ["Mon", "Tue", "Wed", "Thu", "Fri", "Sat", "Sun"] } },
        "timeZone": { "type": "string", "pattern": "^(UTC|[A-Z][A-Za-z]+(/[A-Z][A-Za-z_+-]+){1,2})$", "description": "An IANA time zone name, for example America/Chicago" }
      }
    },
    "hostSharing": {
      "description": "Fact intake.hostSharing (optional). Who shares a session host, which decides between pooled, personal and a separate tenant (avd-assess methods/security.md).",
      "enum": ["one-org-standard", "needs-admin", "multi-org", "undecided"]
    },
    "avdMfa": {
      "description": "Fact intake.avdMfa (optional). Whether sign-in to AVD requires multifactor authentication, until a directory read can see it.",
      "enum": ["required", "not-required", "unknown"]
    },
    "reportedSymptoms": {
      "description": "Fact intake.reportedSymptoms (optional). The problems the operator reports, each picking a triage flow (avd-assess methods/diagnostics.md); none or unknown stand alone.",
      "type": "array",
      "minItems": 1,
      "uniqueItems": true,
      "items": { "enum": ["no-resources", "sign-in-fails", "cannot-connect", "disconnects", "slow-logon", "slow-session", "profile-failed", "host-unhealthy", "none", "unknown"] },
      "anyOf": [
        { "maxItems": 1 },
        { "items": { "not": { "enum": ["none", "unknown"] } } }
      ]
    },
    "appDelivery": {
      "description": "Fact intake.appDelivery (optional). Every way apps reach the session hosts. host-deployment is software distribution to running hosts; app-layering is a third-party app layering or streaming product, as a category (avd-assess gaps/app-delivery-scope.md).",
      "type": "array",
      "minItems": 1,
      "uniqueItems": true,
      "items": {"enum": ["image", "app-attach", "host-deployment", "app-layering", "user-installed", "undecided"]},
      "if": {"contains": {"const": "undecided"}},
      "then": {"maxItems": 1}
    },
    "appCompatibility": {
      "description": "Fact intake.appCompatibility (optional). Whether the estate's apps are known to run on multi-session hosts.",
      "enum": ["all-tested", "some-untested", "known-blockers", "unknown"]
    },
    "profileSolution": {
      "description": "Fact intake.profileSolution (optional). What carries the user profile between sessions; other-profile-product is a third-party profile management product, as a category.",
      "enum": ["fslogix", "other-profile-product", "local-only", "undecided"]
    },
    "hostAgents": {
      "description": "Fact intake.hostAgents (optional). The security agent categories on session hosts, never product names (avd-assess gaps/security-agents-scope.md); Microsoft's own antivirus and EDR are named because the published guidance is theirs. none or unknown stand alone.",
      "type": "array",
      "minItems": 1,
      "uniqueItems": true,
      "items": {"enum": ["defender-antivirus", "defender-endpoint", "third-party-antivirus", "third-party-edr", "sse-ztna-client", "vpn-client", "web-proxy", "dlp-agent", "none", "unknown"]},
      "anyOf": [
        { "maxItems": 1 },
        { "items": { "not": { "enum": ["none", "unknown"] } } }
      ]
    },
    "clientAgents": {
      "description": "Fact intake.clientAgents (optional). What sits in the path on the devices users connect from, as categories (avd-assess gaps/security-agents-scope.md); none or unknown stand alone.",
      "type": "array",
      "minItems": 1,
      "uniqueItems": true,
      "items": {"enum": ["sse-ztna-client", "vpn-full-tunnel", "vpn-split-tunnel", "web-proxy", "tls-inspection", "none", "unknown"]},
      "anyOf": [
        { "maxItems": 1 },
        { "items": { "not": { "enum": ["none", "unknown"] } } }
      ]
    },
    "agentRdpBypass": {
      "description": "Fact intake.agentRdpBypass (optional). Whether RDP traffic is split out of tunnels, proxies and inspection on the user devices, the session hosts, both or neither.",
      "enum": ["both-sides", "client-only", "host-only", "neither", "no-agents", "unknown"]
    },
    "m365PlaneScope": {
      "description": "Fact intake.m365PlaneScope (optional). Whether the estate uses Microsoft 365 productivity configuration for AVD, manages it outside the AVD plane, or does not use M365.",
      "enum": ["in-scope", "managed-separately", "not-used"]
    },
    "powerPlatformPlaneScope": {
      "description": "Fact intake.powerPlatformPlaneScope (optional). Whether the estate uses Power Platform day-2 automation for AVD.",
      "enum": ["in-scope", "not-used"]
    },
    "extensions": {
      "type": "object",
      "description": "Optional, for upper layers only, keyed by namespace (contracts/README.md rule 1). A foundation reader ignores it.",
      "propertyNames": { "pattern": "^[a-z][a-z0-9-]{1,30}$" }
    }
  }
}
